Product Name,Product Url,Prices,Rating,Number of Review,Description,FSN,Product_Description,Manufacturer
"APPLE iPhone 13 (Starlight, 128 GB)",https://www.flipkart.com/apple-iphone-13-starlight-128-gb/p/itmc9604f122ae7f?pid=MOBG6VF5ADKHKXFX&lid=LSTMOBG6VF5ADKHKXFXQGX7PK&marketplace=FLIPKART&q=mobile&store=tyy%2F4io&srno=s_5_113&otracker=AS_QueryStore_OrganicAutoSuggest_1_2_na_na_ps&otracker1=AS_QueryStore_OrganicAutoSuggest_1_2_na_na_ps&fm=organic&iid=a7151b85-5721-433f-a1d6-7a3e0d281596.MOBG6VF5ADKHKXFX.SEARCH&ppt=None&ppn=None&ssid=cn8mbgybkw0000001690221388049&qH=532c28d5412dd75b,"₹61,999",4.7,"12,047","iPhone 13. boasts an advanced dual-camera system that allows you to click mesmerising pictures with immaculate clarity. Furthermore, the lightning-fast A15 Bionic chip allows for seamless multitasking, elevating your performance to a new dimension. A big leap in battery life, a durable design, and a bright Super Retina XDR display facilitate boosting your user experience.",MOBG6VF5ADKHKXFX,"A more vivid OLED display that’s both easier to see in full sunlight and power efficient. With a durable design that’s water and dust-resistant.

Automatically create beautiful depth effects and focus transitions in your videos. Bring a new level of storytelling to the scenes you shoot.

A huge upgrade for better photos and videos. More light is captured with the Wide camera. Sensor-shift optical image stabilisation. And more detail in dark areas of your photos with the Ultra Wide camera.

A big boost in battery life you’ll notice every day. That means more time to watch, game, and do more of what you love with up to 19 hours of video playback on a single charge.

A15 Bionic powers graphics-intensive games and new camera features like Cinematic mode and Photographic Styles. And it’s more efficient, helping deliver longer battery life.","Apple Inc ,1 Infinte Loop,Cupertino,CA 95014,USA"
"Infinix HOT 20 Play (Racing Black, 64 GB)",https://www.flipkart.com/infinix-hot-20-play-racing-black-64-gb/p/itm1e6903eb0203e?pid=MOBGK23WGFWJHRQD&lid=LSTMOBGK23WGFWJHRQD90DLPU&marketplace=FLIPKART&q=mobile&store=tyy%2F4io&srno=s_5_114&otracker=AS_QueryStore_OrganicAutoSuggest_1_2_na_na_ps&otracker1=AS_QueryStore_OrganicAutoSuggest_1_2_na_na_ps&fm=organic&iid=a7151b85-5721-433f-a1d6-7a3e0d281596.MOBGK23WGFWJHRQD.SEARCH&ppt=None&ppn=None&ssid=cn8mbgybkw0000001690221388049&qH=532c28d5412dd75b,"₹7,999",4.4,"1,408",NA,MOBGK23WGFWJHRQD,"That large 17.32 (6.82) Punch Hole display of the Infinix HOT 20 Play is both vivid and immersive. The display is surrounded by a thin bezel, thus maximising the screen size. Additionally, it features a 90 Hz refresh rate that makes scrolling, gaming, and watching videos and shows a fun, refreshing experience.

The HOT 20 Play features a 6000 mAh battery to keep you going for a long time. Additionally, you can charge the phone quickly with the help of an 18 W charger.

The HOT 20 Play is powered by a MediaTek Helio G37 processor to handle multitasking and multiple operations with ease. It also features 4 GB of RAM and 64 GB of internal storage to handle your storage and processing needs. The internal storage can be utilised to expand the RAM by 3 GB. This smartphone also features a triple card slot that supports two 4G SIMs and a MicroSD Card slot that supports up to 256 GB storage.

This mobile features a 13 MP Dual AI Camera with an f1.8 aperture and a Quad-LED Flash to ensure clear and bright pictures. The AI Camera recognises up to 18 different conditions and settings to give you the best possible output when you click photographs.

The Infinix HOT 20 Play comes with an 8 MP Selfie Camera and LED Flash to help you take crisp selfies for your social media game.

The Infinix HOT 20 Play comes with multiple security options to secure your data and privacy. The fast fingerprint sensor and face unlock are swift and effective, thus helping you unlock your phone in a jiffy.

This mobile comes equipped with a dedicated triple card slot, enabling you to simultaneously use two 4G SIMs and a MicroSD Card.

Powered by XOS 10.6 OS based on Android 12 OS, the Infinix HOT 20 Play comes with a number of exciting quality of life features such as Video Assistant, Game Mode, Social Turbo, Eye Care, AI Gallery, OTG Support, and more.","G-Mobile Devices Private Ltd, Unit No. B303, 3rd Floor, Tower B, Plot No.7, Sec-142, Noida, Uttar Pradesh-201301"
Kechaoda K66 The Music House 4,https://www.flipkart.com/kechaoda-k66-music-house-4/p/itmeqggwfcevx2ef?pid=MOBGYFMBRFU6HJSE&lid=LSTMOBGYFMBRFU6HJSEPIBZSL&marketplace=FLIPKART&q=mobile&store=tyy%2F4io&srno=s_5_115&otracker=AS_QueryStore_OrganicAutoSuggest_1_2_na_na_ps&otracker1=AS_QueryStore_OrganicAutoSuggest_1_2_na_na_ps&fm=organic&iid=a7151b85-5721-433f-a1d6-7a3e0d281596.MOBGYFMBRFU6HJSE.SEARCH&ppt=None&ppn=None&ssid=cn8mbgybkw0000001690221388049&qH=532c28d5412dd75b,"₹1,190",3.9,"1,317",NA,MOBGYFMBRFU6HJSE,,Prema Sai Electronics
"REDMI A1+ (Light Blue, 32 GB)",https://www.flipkart.com/redmi-a1-light-blue-32-gb/p/itm4999515e917f6?pid=MOBGGYBAN8HMVT5P&lid=LSTMOBGGYBAN8HMVT5PYMRG3M&marketplace=FLIPKART&q=mobile&store=tyy%2F4io&srno=s_5_116&otracker=AS_QueryStore_OrganicAutoSuggest_1_2_na_na_ps&otracker1=AS_QueryStore_OrganicAutoSuggest_1_2_na_na_ps&fm=organic&iid=a7151b85-5721-433f-a1d6-7a3e0d281596.MOBGGYBAN8HMVT5P.SEARCH&ppt=None&ppn=None&ssid=cn8mbgybkw0000001690221388049&qH=532c28d5412dd75b,"₹6,299",4.2,342,"The innovative Redmi A1+ smartphone provides an amazing user experience. Enjoy stunning graphics and enjoy flawless operation. This phone includes a large HD+ display that supports both light and dark modes, a touch sampling rate of 120 Hz, and a display brightness of 400 nits. Furthermore, you can capture the event and create beautiful memories that serve as a constant reminder of it with the 8 MP Dual AI camera setup, which consists of a 5 MP front camera and an 8 MP main camera. The MediaTek Helio A22 chipset and quick LPDDR4X RAM on this smartphone also enable a fluid streaming experience and a remarkable battery life.",MOBGGYBAN8HMVT5P,"The rear of this phone has a stylish fingerprint sensor that makes it possible to unlock your phone in the most efficient manner and keep it highly safe.

With the Redmi A1+'s leather texture design, which provides you with a terrific grip, a modern appearance, and a smudge-free touch, you can experience a sense of luxury that just feels right in your hands.

This phone has a large HD+ display that supports a touch sampling rate of 120 Hz, a display brightness of 400 nits, and both light and dark modes.

With a large 5000 mAh battery and a 10 W charger included in the box, this smartphone offers up to 30 days of standby life, 171 hours of music playing, 30 hours of movie playback, and 31.5 hours of VoLTE calling.

With the 8 MP Dual AI camera configuration, which consists of a 5 MP front camera and an 8 MP main camera, you can capture the moment and produce lovely memories that remind you of it every time you see them.

This smartphone boasts a MediaTek Helio A22 processor and fast LPDDR4X RAM, all of which allow for a seamless streaming experience and commendable battery life.

Get a genuine Android experience with the Redmi A1+ thanks to Android 12. With Faster AI, it offers a clear streaming experience and aids in data conservation.

The Redmi A1+ has a dedicated SD card slot, two sim card slots, a 3.5 mm socket, and a top-firing speaker for superb sound.","Xiaomi Technology India Pvt. Ltd., Orchid Blck, EmbassyTech Village, Devarabeesanahalli,Bangalore - 560103, Karnataka"
"POCO M4 5G (Yellow, 64 GB)",https://www.flipkart.com/poco-m4-5g-yellow-64-gb/p/itm5bd9222dd1355?pid=MOBGDRGPBZHUC3VZ&lid=LSTMOBGDRGPBZHUC3VZKR84R7&marketplace=FLIPKART&q=mobile&store=tyy%2F4io&srno=s_5_117&otracker=AS_QueryStore_OrganicAutoSuggest_1_2_na_na_ps&otracker1=AS_QueryStore_OrganicAutoSuggest_1_2_na_na_ps&fm=organic&iid=a7151b85-5721-433f-a1d6-7a3e0d281596.MOBGDRGPBZHUC3VZ.SEARCH&ppt=None&ppn=None&ssid=cn8mbgybkw0000001690221388049&qH=532c28d5412dd75b,"₹11,999",4.2,"5,946","Break all barriers and enjoy an unmatched smartphone experience with the POCO M4 5G that is designed to send chills across your body from the moment you start using it. This phone comes loaded with the Dimensity 700 processor, UFS 2.2 WriteBooster, and up to 2 GB of Turbo RAM that boosts your performance and makes multitasking a piece of cake. Moreover, the dual-camera setup with a 50 MP primary camera and 8 MP front camera allows you to click masterpieces and cherish the brilliance of their imagery.",MOBGDRGPBZHUC3VZ,"The POCO M4 5G boasts a meticulous design that is aimed at putting you in the spotlight wherever you go. With this phone in your hands, you can literally feel the whole world looking at you with envy.

The Dimensity 700 processor, UFS 2.2 WriteBooster, and up to 2 GB of Turbo RAM in the POCO M4 5G enable you to tackle all of your daily tasks with ease. Furthermore, the POCO M4 5G supports seven 5G bands, guaranteeing that you are constantly connected to the world.

The POCO M4 5G features a 16.71 cm (6.58) Smart display with a 90 Hz refresh rate and a 240 Hz touch sampling rate. While gaming, browsing, streaming, and other activities, the display gives an incredibly fluid visual effect. Moreover, to provide optimal battery life, the smart display changes between refresh rates based on usage.

This smartphone comes equipped with a dual-camera setup comprising of a 50 MP primary camera that enables you to click stunning images with enthralling imagery. Furthermore, this phone also comes with an 8 MP front camera designed to click impeccable selfies that can blow your mind away with its clarity.

With a 5000 mAh battery being employed in this phone, you can continue to use it for gaming, streaming, and much more for up to 2 days on a single charge. Moreover, it also supports 18 W fast charging that can power your phone in quick succession.","Xiaomi Technology India Pvt. Ltd., Orchid Blck, EmbassyTech Village, Devarabeesanahalli,Bangalore - 560103, Karnataka"
Nokia 105 ss,https://www.flipkart.com/nokia-105-ss/p/itm5319c7a0413cb?pid=MOBEWXFKRHBRWFD5&lid=LSTMOBEWXFKRHBRWFD5MIYVOR&marketplace=FLIPKART&q=mobile&store=tyy%2F4io&srno=s_5_118&otracker=AS_QueryStore_OrganicAutoSuggest_1_2_na_na_ps&otracker1=AS_QueryStore_OrganicAutoSuggest_1_2_na_na_ps&fm=organic&iid=a7151b85-5721-433f-a1d6-7a3e0d281596.MOBEWXFKRHBRWFD5.SEARCH&ppt=None&ppn=None&ssid=cn8mbgybkw0000001690221388049&qH=532c28d5412dd75b,"₹1,549",4.3,"7,333",NA,MOBEWXFKRHBRWFD5,,"RISING STARS MOBILE INDIA PVT LTD Plot: M-2B,Sipcot Industrial Park, Phase-2, Hi Tech SEZ DTA Area,Kancheepuram, 602106"
Kechaoda K112,https://www.flipkart.com/kechaoda-k112/p/itmf3qzutndjrsrb?pid=MOBF3MG3MPFH6RNE&lid=LSTMOBF3MG3MPFH6RNEPD0UFM&marketplace=FLIPKART&q=mobile&store=tyy%2F4io&srno=s_5_119&otracker=AS_QueryStore_OrganicAutoSuggest_1_2_na_na_ps&otracker1=AS_QueryStore_OrganicAutoSuggest_1_2_na_na_ps&fm=organic&iid=a7151b85-5721-433f-a1d6-7a3e0d281596.MOBF3MG3MPFH6RNE.SEARCH&ppt=None&ppn=None&ssid=cn8mbgybkw0000001690221388049&qH=532c28d5412dd75b,"₹1,499",4,"2,296", ,MOBF3MG3MPFH6RNE,,"S K T C L, Hongxin Industrial Park,Guanlan Street,Longhua District,Shenzhen"
"POCO M4 Pro (Yellow, 128 GB)",https://www.flipkart.com/poco-m4-pro-yellow-128-gb/p/itm2c781ce3142ae?pid=MOBGBTHFVTYQCZQG&lid=LSTMOBGBTHFVTYQCZQGMHTOKH&marketplace=FLIPKART&q=mobile&store=tyy%2F4io&srno=s_5_120&otracker=AS_QueryStore_OrganicAutoSuggest_1_2_na_na_ps&otracker1=AS_QueryStore_OrganicAutoSuggest_1_2_na_na_ps&fm=organic&iid=a7151b85-5721-433f-a1d6-7a3e0d281596.MOBGBTHFVTYQCZQG.SEARCH&ppt=None&ppn=None&ssid=cn8mbgybkw0000001690221388049&qH=532c28d5412dd75b,"₹13,999",4.2,"1,829", ,MOBGBTHFVTYQCZQG,"The POCO M4 Pro has a 16.33 cm (6.43) SuperAMOLED screen with a 90 Hz refresh rate and a touch sampling rate of 180 Hz that helps in the smooth operation of this phone. With dazzling colours and an extensive DCI P3 colour spectrum, the display gives an incredible viewing experience. It functions seamlessly while playing games, browsing the internet, and watching movies. Furthermore, 1000 nits of peak brightness provide a pleasant vision even in the scorching sunlight.

This phone has a triple camera configuration, that includes a 64 MP primary camera and an 8 MP Ultra-wide camera with a 118-degree field of vision, making it an ideal companion for photography enthusiasts, especially content developers. It also boasts a 16 MP front camera to suffice your selfie obsession.

Weighing around 179.5 g and featuring an elegantly designed rear that feels terrific in the hand this POCO M4 Pro features a compact and intuitive design that prevents fingerprints and smudges.

This gadget is equipped with a Helio G96 processor with 8 GB of RAM and 128 GB of internal memory, which works in conjunction with UFS 2.2 WriteBooster and Liquid Cooling Technology to provide outstanding performance for all of your daily tasks whilst maintaining the device at an optimal temperature. Furthermore, This phone comes with the Turbo RAM feature, which turns idle memory into RAM for efficient productivity.

This POCO M4 Pro offers a 5000 mAh battery that can last up to two days. It has 33 W Fast Charging with MMT technology, which allows you to charge your phone completely in about 61 minutes without overheating it.","Xiaomi Technology India Pvt. Ltd., Orchid Blck, EmbassyTech Village, Devarabeesanahalli,Bangalore - 560103, Karnataka"
"OPPO Reno10 5G (Silvery Grey, 256 GB)",https://www.flipkart.com/oppo-reno10-5g-silvery-grey-256-gb/p/itmdedc9618cea51?pid=MOBGQP3UFZA4KJYV&lid=LSTMOBGQP3UFZA4KJYVA5FVFS&marketplace=FLIPKART&q=mobile&store=tyy%2F4io&srno=s_6_121&otracker=AS_QueryStore_OrganicAutoSuggest_1_2_na_na_ps&otracker1=AS_QueryStore_OrganicAutoSuggest_1_2_na_na_ps&fm=organic&iid=en_cxmJ1cBsVdx_VxdwCH7v5bAblQlDV0Cqtcp-sKUrYjzR0yHiCWvLx9WAWz3vKSbpEedVYWBEuWhz4uq4gaIipw%3D%3D&ppt=None&ppn=None&ssid=6hxitkzebk0000001690221390749&qH=532c28d5412dd75b,"₹32,999",Not Available,0, ,MOBGQP3UFZA4KJYV,"With the improved imaging hardware camera in this Oppo Reno 10 5G smartphone, you can capture impressive pictures in high clarity. When your friends take photos in this camera, they are going to fall in love with your phone and would always wish for your phone’s camera for all their photoshoots. With a 64 MP Main Camera, 32 MP Telephoto Camera, 112-degree ultra-wide-angle camera, and 32 MP ultra-clear selfie camera, this phone has an awesome camera setup to lighten your moods at all times.

With the high-resolution Telephoto Camera available on this mobile, you can take pictures like a pro and create an album with innumerable photos and videos. The camera is equipped with a Sony IMX709 flagship sensor camera that offers professional portrait focal length photography where you can click clear, natural, and vivid portrait images all the time and cherish these memories for years to come.

Beautiful and blurred bokeh backgrounds are just a click away by adjusting the aperture on this phone’s camera. Take high-quality photos as you would take with your DSLR camera and just be surprised with the amazing comments you would receive from your friends and family.

This phone is designed by industry experts and has included an exclusive Portrait mode to capture moments that are worth creating memories. Perfect your every shot with the Portrait Expert Engine and be amazed by the resulting photos that are sure to mesmerise you with its perfection.

This phone has a 50 MP OIS main camera that clicks ultra-clear pictures. The camera on this phone is 112 degrees ultra-wide angle with AutoFocus smart selfie feature that lets you capture beautiful pictures of yourself and groups. Record 4K ultra-clear video whenever you are in the mood to take short videos, create reels, or simply record an event or a session.

The 3D curved design of this Oppo Reno 10 5G smartphone brings richness to the overall aesthetics of this phone. You are sure to attract onlookers with its sheer beauty, smooth contours that just fits right on your palm.

This phone delivers rock-solid performance and feels as light as a feather. The sleek design of the phone and its slim structure simply create a style statement. It weighs only about 185g and is about 7.99 mm in thickness.

Experience the ultimate comfort and convenience of scrolling through apps on this 3D curved Oppo Reno 10 smartphone. This phone is indeed an unmatched combination of comfort and elegance that you would always want to hold in your hands.

Powered with a 5000 mAh battery, this phone is a powerhouse of energy and can run for an entire day. Along with this device, you get a 67 W flash charger that can charge from 0 to 31% in just 10 minutes. The Battery Health Engine in this phone increases your battery durability by up to 4 years. With just 5 minutes of charging your phone, you can have 3.5 hours of video playback time.

Experience unbelievably smooth and quick performance with the MediaTek Dimensity 7050 SoC Processor. Effortlessly stream applications and scroll through apps swiftly at a lightning-fast speed. You get 8 GB of RAM that can be expandable up to 8 GB and vast storage space of 256 GB.

To let you use a smooth-running phone that can keep pace with your lifestyle and changing needs even after 48 months of use, Oppo has designed an interesting system-level technology that improves your stability and fluency greatly. This Oppo smartphone comes with TUV SUD 48-Month Fluency Rating A"" with 16 times memory access capability. You will also be able to run 40+ active apps in the background.

With loud and dual stereo speakers, you can hear your favourite music in full sound. These speakers are so powerful that they provide an immersive sound experience where every note and every rhythm comes alive.

You can work across different devices smoothly and seamlessly and can also screencast or share apps, files, content, notifications, etc., across your Oppo PC, phone, and Oppo Pads.

With IR remote control, you can easily control the smart appliances in your home with your phone. You can also change the settings of devices, change the speed of the fan, turn off lights, ACs, etc., right from your phone and get the complete control of your environment in your hands with the IR remote control.

With the smart Always-on-Display feature, you can receive notifications in real-time and also get information about your orders and takeaways. You also get to seamlessly connect to the music playlist with the Always-On-Display functionality that ensures uninterrupted connectivity even when your device is locked.

With the Auto Pixelate feature available on this smartphone, you can now protect your privacy while still being able to stay social. You can easily pixelate avatars and names on a single click when you share screenshots from your phone.","OPPO Mobiles India Private Limited Plot No.1, Sector Ecotech: VII, Greater Noida, Uttar Pradesh 201306"
Micromax S114,https://www.flipkart.com/micromax-s114/p/itm4d4847db9bac4?pid=MOBGKHZBHE8PNGQJ&lid=LSTMOBGKHZBHE8PNGQJ4JKRJR&marketplace=FLIPKART&q=mobile&store=tyy%2F4io&srno=s_6_122&otracker=AS_QueryStore_OrganicAutoSuggest_1_2_na_na_ps&otracker1=AS_QueryStore_OrganicAutoSuggest_1_2_na_na_ps&fm=organic&iid=74eab383-d199-47dd-875b-560a74e0d576.MOBGKHZBHE8PNGQJ.SEARCH&ppt=None&ppn=None&ssid=6hxitkzebk0000001690221390749&qH=532c28d5412dd75b,₹908,3.7,15,"Micromax S114 with 1000 mAh battery, Wireless FM Radio, Bright Torch",MOBGKHZBHE8PNGQJ,,Bhagwati Products Limited
Micromax S114,https://www.flipkart.com/micromax-s114/p/itm4d4847db9bac4?pid=MOBGKHZC76G4HPXT&lid=LSTMOBGKHZC76G4HPXTOMUIJE&marketplace=FLIPKART&q=mobile&store=tyy%2F4io&srno=s_6_123&otracker=AS_QueryStore_OrganicAutoSuggest_1_2_na_na_ps&otracker1=AS_QueryStore_OrganicAutoSuggest_1_2_na_na_ps&fm=organic&iid=74eab383-d199-47dd-875b-560a74e0d576.MOBGKHZC76G4HPXT.SEARCH&ppt=None&ppn=None&ssid=6hxitkzebk0000001690221390749&qH=532c28d5412dd75b,₹910,3.7,15,"Micromax S114 with 1000 mAh battery, Wireless FM Radio, Bright Torch",MOBGKHZC76G4HPXT,,Bhagwati Products Limited
Nokia 105 ss,https://www.flipkart.com/nokia-105-ss/p/itm5319c7a0413cb?pid=MOBEWXFKRHBRWFD5&lid=LSTMOBEWXFKRHBRWFD5MIYVOR&marketplace=FLIPKART&q=mobile&store=tyy%2F4io&srno=s_6_124&otracker=AS_QueryStore_OrganicAutoSuggest_1_2_na_na_ps&otracker1=AS_QueryStore_OrganicAutoSuggest_1_2_na_na_ps&fm=organic&iid=74eab383-d199-47dd-875b-560a74e0d576.MOBEWXFKRHBRWFD5.SEARCH&ppt=None&ppn=None&ssid=6hxitkzebk0000001690221390749&qH=532c28d5412dd75b,"₹1,549",4.3,"7,333",NA,MOBEWXFKRHBRWFD5,,"RISING STARS MOBILE INDIA PVT LTD Plot: M-2B,Sipcot Industrial Park, Phase-2, Hi Tech SEZ DTA Area,Kancheepuram, 602106"
"SAMSUNG Galaxy F13 (Sunrise Copper, 64 GB)",https://www.flipkart.com/samsung-galaxy-f13-sunrise-copper-64-gb/p/itm0d8c65ec17621?pid=MOBGENJWWRYSFC5P&lid=LSTMOBGENJWWRYSFC5P0ONQMC&marketplace=FLIPKART&q=mobile&store=tyy%2F4io&srno=s_6_125&otracker=AS_QueryStore_OrganicAutoSuggest_1_2_na_na_ps&otracker1=AS_QueryStore_OrganicAutoSuggest_1_2_na_na_ps&fm=organic&iid=74eab383-d199-47dd-875b-560a74e0d576.MOBGENJWWRYSFC5P.SEARCH&ppt=None&ppn=None&ssid=6hxitkzebk0000001690221390749&qH=532c28d5412dd75b,"₹10,999",4.3,"9,205","Enjoy seamless connectivity and an uninterrupted movie marathon with the impressive Samsung Galaxy F13 that is designed specifically to impress the entertainment fanatics. This smartphone features a terrific 16.62 cm (6.6) FHD+ LCD Display that can effortlessly blow your mind with its incredible performance. Furthermore, this phone boasts a 50 MP Triple Camera setup that allows you to capture awesomeness with a gentle tap. Moreover, the Samsung Galaxy F13 sports up to 8 GB of RAM and features an innovative RAM plus technology that taps into the phone’s internal storage to elevate its performance.",MOBGENJWWRYSFC5P,"The Samsung Galaxy F13 boasts an exceptional 16.62 cm (6.6) FHD+ LCD Display that delivers a cinematic visual experience with stunning picture quality. Thus, you can seamlessly immerse yourself into your favourite movie with enhanced precision.

Thanks to the Gorilla Glass 5 adapted into this smartphone’s screen which protects it from inadvertent falls and scratches. This way you can carry your phone anywhere without any inhibition.

The Samsung Galaxy F13 comes with a monstrous 6000 mAh Battery that supports 15 W Fast Charging, allowing you to binge-watch your favourite TV show and play your favourite game seamlessly.

With the Auto Data Switching feature incorporated in this phone which automatically chooses from the best available network provider, you can enjoy unmatched data connectivity wherever you are and always stay connected to the world.

Driven by up to 8 GB of RAM and sporting an incredible RAM Plus feature that uses the phone’s internal storage and converts into virtual RAM, there is practically no stopping your multitasking ability. This way you can amplify your entertainment quotient significantly.

This phone features a stunning 50 MP Triple Camera setup that helps you to capture mesmerising images with exceptional imagery, allowing you to savour memorable events whenever your heart desires.

Your sensitive and secret data will be safeguarded wherever you go courtesy of the multi-layered Knox security built into this device, which keeps you stress-free at all times.",Samsung India Electroincs Pvt. Ltd.6th FloorDLF CenterSansad Marg New Delhi
