Product Name,Product Url,Prices,Rating,Number of Review,Description,FSN,Product_Description,Manufacturer
"vivo T2 5G (Velocity Wave, 128 GB)",https://www.flipkart.com/vivo-t2-5g-velocity-wave-128-gb/p/itma79eb573156a4?pid=MOBGZBFU3KXMFYHP&lid=LSTMOBGZBFU3KXMFYHPQBLL0Y&marketplace=FLIPKART&q=mobile&store=tyy%2F4io&srno=s_3_49&otracker=AS_QueryStore_OrganicAutoSuggest_1_2_na_na_ps&otracker1=AS_QueryStore_OrganicAutoSuggest_1_2_na_na_ps&fm=organic&iid=92898ef3-1a2e-4ab4-946d-0822299c9feb.MOBGZBFU3KXMFYHP.SEARCH&ppt=None&ppn=None&ssid=7p671kv60w0000001690221382421&qH=532c28d5412dd75b,"₹18,999",4.4,"2,155","The Vivo T2 5G smartphone has an FHD+ AMOLED display for easy access and immersive viewing. The 90 Hz AMOLED display allows you to multitask easily. It has a 64 MP OIS anti-shake camera that allows you to capture steady images. This smartphone features a powerful Snapdragon 695 for smooth functioning. The FlashCharge enables you with fast charging and determines the optimal charging strategy if the phone is in use or if the screen is off while plugged in. This smartphone allows you to use multiple apps at the same time, thanks to its Extended RAM 3.0. The Bokeh Flare Portrait makes you stand out in the crowd, so that you can take stunning photos.",MOBGZBFU3KXMFYHP,"The Vivo T2 5G smartphone has a 90 Hz AMOLED display so that you can use multiple apps at the same time and enjoy immersive viewing. This display allows you to view the screen clearly in even direct sunlight. The 1000 Hz of touch sampling rate provides instant screen response for lag-free usage.

You can capture steady photos and videos on its 64 MP anti-shake camera, thanks to the OIS and EIS technology. The anti-shake camera also features different portrait styles so that you always stand out in your photos.

Courtesy to the Snapdragon 695 smart processor, you can enjoy smooth and stable performance while gaming or multitasking.

Thanks to the 44W FlashCharge, your phone charges quickly and lasts all day long. The FlashCharge determines the optimal charging strategy based on whether the screen is off or in use while plugged in. It also extends the battery life by up to 25% and reduces deterioration.

You can multitask easily on this smartphone with up to 27 apps running in the background, thanks to the Extended RAM 3.0. This RAM allows you to switch between apps and activate them quickly when touched.

The bokeh flare portrait allows you to stand out in every picture by blurring the background. You can also choose from the different spot effects to capture stunning photos.

You can enjoy night photography with the night mode featured in this smartphone. You can capture your favourite moments even in low light as this mode removes the noise and blur in the images.

The Vivo T2 5G smartphone has an elegant design with slim bezel. It has a dual-ring rear camera which gives it a bold statement look and provides a strong grip for easy access.",vivo Mobile India Private Limited TEC-1 and TEC-2 World Trade Centre Plot No TZ-13A Techzone IT Park Noida-201308
"MOTOROLA G62 5G (Midnight Gray, 128 GB)",https://www.flipkart.com/motorola-g62-5g-midnight-gray-128-gb/p/itm37da299ffb2d0?pid=MOBGEDT5ZZMZQZSJ&lid=LSTMOBGEDT5ZZMZQZSJFXDZSQ&marketplace=FLIPKART&q=mobile&store=tyy%2F4io&srno=s_3_50&otracker=AS_QueryStore_OrganicAutoSuggest_1_2_na_na_ps&otracker1=AS_QueryStore_OrganicAutoSuggest_1_2_na_na_ps&fm=organic&iid=92898ef3-1a2e-4ab4-946d-0822299c9feb.MOBGEDT5ZZMZQZSJ.SEARCH&ppt=None&ppn=None&ssid=7p671kv60w0000001690221382421&qH=532c28d5412dd75b,"₹15,499",4.1,"3,455","With the Moto G62, you can enjoy lag-free gaming, seamless multitasking, and stunning stutter-free graphics. This phone allows you to juggle while savouring entertainment owing to its astounding 16.51 cm (6.5) FHD+ Ultra-smooth display and refresh rate of 120 Hz. In addition, you can perform excellently without the smartphone overheating thanks to the Snapdragon 695 5G processor and 6 GB of RAM. Moreover, this phone's 50 MP main camera allows you to capture breathtaking images with incredible imagery.",MOBGEDT5ZZMZQZSJ,"With the Moto G62's exceptional 5G speed, you can download movies and TV shows to keep you entertained over the weekend without experiencing any stuttering or lag. Additionally, the uninterrupted data connection allows for jitter-free surfing without the need for a buffer.

With this excellent smartphone's flawless performance, you can experience blazingly high performance. With the Snapdragon 695 5G processor and a potent 6 GB of RAM, you can easily complete difficult tasks and remain one step ahead of your competition. Additionally, you can watch your preferred movies and TV series without any restrictions.

You can enjoy dramatic images and lag-free gaming on the 16.51 cm (6.5) FHD+ ultra-smooth display, which has a fantastic refresh rate of 120 Hz and fits perfectly in your palm.

The Dolby Atoms sound system on the Moto G62 gives you the ability to groove to your favourite songs and take in every musical element with an utterly engrossing acoustic experience.

A 50 MP camera with Quad Pixel technology that produces sharp, significantly colourful images makes every click appear fantastic. Additionally, an innovative sensor that recognises the depth and works in tandem with the primary camera to produce photographs that seem professional and mindblowing.

This phone features a substantial 5000 mAh battery that makes juggling and productivity possible without worrying about running out of power. Additionally, the robust battery adapted in this phone allows you to deliver efficient performance and enables you to stay ahead of the competition.

Splatters and spills are kept at bay by the Moto G62's IP52 Water-repellent Design. Whether you're going for a workout or taking your phone to a stormy location to snap stunning shots, the special water-repellent construction keeps it secure and waterproof.

With a few simple hand gestures, you can effortlessly manage your phone and alter its design to perfectly reflect your persona. Additionally, it's made to assist you do tasks quickly and intelligently using ungraded technologies and an upgraded user interface.

With the help of a stupendous ThinkShield technology in this phone, your data is fully protected from spyware, phishing, and other possible threats from the hardware to the software of your mobile device.","Motorola India Pvt Ltd 12th floor, Tower-D DLF phase-3, Cyber Greens, Gurgaon-122001"
"OPPO Reno10 5G (Silvery Grey, 256 GB)",https://www.flipkart.com/oppo-reno10-5g-silvery-grey-256-gb/p/itmdedc9618cea51?pid=MOBGQP3UFZA4KJYV&lid=LSTMOBGQP3UFZA4KJYVA5FVFS&marketplace=FLIPKART&q=mobile&store=tyy%2F4io&srno=s_3_51&otracker=AS_QueryStore_OrganicAutoSuggest_1_2_na_na_ps&otracker1=AS_QueryStore_OrganicAutoSuggest_1_2_na_na_ps&fm=organic&iid=en_YHN3yv93LAVv71yBw_x4-smff7YPh7HzjC_LhmhtmvaS4TxTgroXMpNaeSYfiZ-PEedVYWBEuWhz4uq4gaIipw%3D%3D&ppt=None&ppn=None&ssid=7p671kv60w0000001690221382421&qH=532c28d5412dd75b,"₹32,999",Not Available,0, ,MOBGQP3UFZA4KJYV,"With the improved imaging hardware camera in this Oppo Reno 10 5G smartphone, you can capture impressive pictures in high clarity. When your friends take photos in this camera, they are going to fall in love with your phone and would always wish for your phone’s camera for all their photoshoots. With a 64 MP Main Camera, 32 MP Telephoto Camera, 112-degree ultra-wide-angle camera, and 32 MP ultra-clear selfie camera, this phone has an awesome camera setup to lighten your moods at all times.

With the high-resolution Telephoto Camera available on this mobile, you can take pictures like a pro and create an album with innumerable photos and videos. The camera is equipped with a Sony IMX709 flagship sensor camera that offers professional portrait focal length photography where you can click clear, natural, and vivid portrait images all the time and cherish these memories for years to come.

Beautiful and blurred bokeh backgrounds are just a click away by adjusting the aperture on this phone’s camera. Take high-quality photos as you would take with your DSLR camera and just be surprised with the amazing comments you would receive from your friends and family.

This phone is designed by industry experts and has included an exclusive Portrait mode to capture moments that are worth creating memories. Perfect your every shot with the Portrait Expert Engine and be amazed by the resulting photos that are sure to mesmerise you with its perfection.

This phone has a 50 MP OIS main camera that clicks ultra-clear pictures. The camera on this phone is 112 degrees ultra-wide angle with AutoFocus smart selfie feature that lets you capture beautiful pictures of yourself and groups. Record 4K ultra-clear video whenever you are in the mood to take short videos, create reels, or simply record an event or a session.

The 3D curved design of this Oppo Reno 10 5G smartphone brings richness to the overall aesthetics of this phone. You are sure to attract onlookers with its sheer beauty, smooth contours that just fits right on your palm.

This phone delivers rock-solid performance and feels as light as a feather. The sleek design of the phone and its slim structure simply create a style statement. It weighs only about 185g and is about 7.99 mm in thickness.

Experience the ultimate comfort and convenience of scrolling through apps on this 3D curved Oppo Reno 10 smartphone. This phone is indeed an unmatched combination of comfort and elegance that you would always want to hold in your hands.

Powered with a 5000 mAh battery, this phone is a powerhouse of energy and can run for an entire day. Along with this device, you get a 67 W flash charger that can charge from 0 to 31% in just 10 minutes. The Battery Health Engine in this phone increases your battery durability by up to 4 years. With just 5 minutes of charging your phone, you can have 3.5 hours of video playback time.

Experience unbelievably smooth and quick performance with the MediaTek Dimensity 7050 SoC Processor. Effortlessly stream applications and scroll through apps swiftly at a lightning-fast speed. You get 8 GB of RAM that can be expandable up to 8 GB and vast storage space of 256 GB.

To let you use a smooth-running phone that can keep pace with your lifestyle and changing needs even after 48 months of use, Oppo has designed an interesting system-level technology that improves your stability and fluency greatly. This Oppo smartphone comes with TUV SUD 48-Month Fluency Rating A"" with 16 times memory access capability. You will also be able to run 40+ active apps in the background.

With loud and dual stereo speakers, you can hear your favourite music in full sound. These speakers are so powerful that they provide an immersive sound experience where every note and every rhythm comes alive.

You can work across different devices smoothly and seamlessly and can also screencast or share apps, files, content, notifications, etc., across your Oppo PC, phone, and Oppo Pads.

With IR remote control, you can easily control the smart appliances in your home with your phone. You can also change the settings of devices, change the speed of the fan, turn off lights, ACs, etc., right from your phone and get the complete control of your environment in your hands with the IR remote control.

With the smart Always-on-Display feature, you can receive notifications in real-time and also get information about your orders and takeaways. You also get to seamlessly connect to the music playlist with the Always-On-Display functionality that ensures uninterrupted connectivity even when your device is locked.

With the Auto Pixelate feature available on this smartphone, you can now protect your privacy while still being able to stay social. You can easily pixelate avatars and names on a single click when you share screenshots from your phone.","OPPO Mobiles India Private Limited Plot No.1, Sector Ecotech: VII, Greater Noida, Uttar Pradesh 201306"
"MOTOROLA e13 (Aurora Green, 64 GB)",https://www.flipkart.com/motorola-e13-aurora-green-64-gb/p/itmb52d8f826cd9a?pid=MOBGKHNBA55HDSZR&lid=LSTMOBGKHNBA55HDSZRHOAFME&marketplace=FLIPKART&q=mobile&store=tyy%2F4io&srno=s_3_52&otracker=AS_QueryStore_OrganicAutoSuggest_1_2_na_na_ps&otracker1=AS_QueryStore_OrganicAutoSuggest_1_2_na_na_ps&fm=organic&iid=92898ef3-1a2e-4ab4-946d-0822299c9feb.MOBGKHNBA55HDSZR.SEARCH&ppt=None&ppn=None&ssid=7p671kv60w0000001690221382421&qH=532c28d5412dd75b,"₹7,299",4,"2,873","With the all-new moto e13, you can enjoy advanced capabilities with up to 4 GB of RAM and cruise through a hectic day with ease. Store everything you love and more with 64 GB of storage that’s expandable up to 1 TB. Equipped with a powerful UNISOC T606 Processor, you’ll get a performance like never before. Scroll, stream, search, and socialise with a 5000mAh battery that lets you watch videos for up to 23 hours, listen to music for up to 225 hours and browse your favourite social media platforms for up to 21 hours. Additionally, with a premium design and a sleek body, it’s sure to make some heads turn. Take your theatre to-go when you have a 16.5 cm (6.5) ultra-wide screen IPS LCD screen and Dolby Atmos that gives you unmatched entertainment.",MOBGKHNBA55HDSZR,"An uninterrupted life requires a smartphone that can keep up with you. Enjoy advanced capabilities powered by a UNISOC T606 Processor with up to 4 GB of RAM. Photos, movies, songs, and apps have more room with 64 GB of built-in storage. Use microSD to expand your storage to 1 TB and make sure that life 'Atke Nahi'!

Give a break to the power outlet. The long-lasting 5000 mAh battery keeps you listening to playlists longer, and video chatting with friends for hours on end, and makes sure you get to spend your day with your phone, without interruptions.

Get the style you’re craving with a phone that’s hard to put down. Make heads turn with an incredible design that is <8.5mm slim and <180gm light that’s brilliantly complimented by a PMMA body, and colours that make you look ‘Hatke’.

Live 'Hatke' and enjoy entertainment on the go! Bring your favourite content to life on a stunning 16.5 cm (6.5) ultra-wide screen with built-in IPS technology on the LCD screen. Hear what you’ve been missing in shows, movies, and music. Listen with greater depth, clarity, and details than ever before with Dolby Atmos and enjoy a multidimensional audio-visual experience, every day.

With an Android 13 OS Go edition, you enjoy a more reliable, usable, and personal Android experience. Get essential updates and stay up-to-date without compromising lots of storage space with Google Play System Updates. Discover something new from around the Internet right from your home screen. Express your personal style with dynamic colour themes that allow you to transform your phone’s look based on your wallpaper.

Shoot your best photos and selfies ever with the 13 MP AI-powered camera system and share them at the moment on social media. With intelligent features like Auto Smile Capture, the 13 MP camera recognizes when everyone in the frame is smiling and snaps a picture. Plus, you can capture 'Hatke' selfies with a 5 MP Selfie Camera and look your best.

Stay worry-free with one of the only phones (in the segment) equipped with an IP52-rated water-repellent body. Your phone will stay protected against any accidental spills or splashes that may come your way. Whether you’re going for a run or taking a call in the rain, a water-repellent design keeps your phone safe and keeps you worry-free.

Loaded with class-leading ""Hatke"" features like Dual Band WiFi, 3-in-3 Card Slots, a Type C port, a 10 W charger, 2X2 MIMO, and Bluetooth 5.0, the motoe13 is a gift that keeps on giving.","Motorola India Pvt Ltd 12th floor, Tower-D DLF phase-3, Cyber Greens, Gurgaon-122001"
"vivo T2 5G (Velocity Wave, 128 GB)",https://www.flipkart.com/vivo-t2-5g-velocity-wave-128-gb/p/itma79eb573156a4?pid=MOBGZBFU2GHZTMGN&lid=LSTMOBGZBFU2GHZTMGNEFEQUV&marketplace=FLIPKART&q=mobile&store=tyy%2F4io&srno=s_3_53&otracker=AS_QueryStore_OrganicAutoSuggest_1_2_na_na_ps&otracker1=AS_QueryStore_OrganicAutoSuggest_1_2_na_na_ps&fm=organic&iid=92898ef3-1a2e-4ab4-946d-0822299c9feb.MOBGZBFU2GHZTMGN.SEARCH&ppt=None&ppn=None&ssid=7p671kv60w0000001690221382421&qH=532c28d5412dd75b,"₹20,999",4.4,463,"The Vivo T2 5G smartphone has an FHD+ AMOLED display for easy access and immersive viewing. The 90 Hz AMOLED display allows you to multitask easily. It has a 64 MP OIS anti-shake camera that allows you to capture steady images. This smartphone features a powerful Snapdragon 695 for smooth functioning. The FlashCharge enables you with fast charging and determines the optimal charging strategy if the phone is in use or if the screen is off while plugged in. This smartphone allows you to use multiple apps at the same time, thanks to its Extended RAM 3.0. The Bokeh Flare Portrait makes you stand out in the crowd, so that you can take stunning photos.",MOBGZBFU2GHZTMGN,"The Vivo T2 5G smartphone has a 90 Hz AMOLED display so that you can use multiple apps at the same time and enjoy immersive viewing. This display allows you to view the screen clearly in even direct sunlight. The 1000 Hz of touch sampling rate provides instant screen response for lag-free usage.

You can capture steady photos and videos on its 64 MP anti-shake camera, thanks to the OIS and EIS technology. The anti-shake camera also features different portrait styles so that you always stand out in your photos.

Courtesy to the Snapdragon 695 smart processor, you can enjoy smooth and stable performance while gaming or multitasking.

Thanks to the 44W FlashCharge, your phone charges quickly and lasts all day long. The FlashCharge determines the optimal charging strategy based on whether the screen is off or in use while plugged in. It also extends the battery life by up to 25% and reduces deterioration.

You can multitask easily on this smartphone with up to 27 apps running in the background, thanks to the Extended RAM 3.0. This RAM allows you to switch between apps and activate them quickly when touched.

The bokeh flare portrait allows you to stand out in every picture by blurring the background. You can also choose from the different spot effects to capture stunning photos.

You can enjoy night photography with the night mode featured in this smartphone. You can capture your favourite moments even in low light as this mode removes the noise and blur in the images.

The Vivo T2 5G smartphone has an elegant design with slim bezel. It has a dual-ring rear camera which gives it a bold statement look and provides a strong grip for easy access.",vivo Mobile India Private Limited TEC-1 and TEC-2 World Trade Centre Plot No TZ-13A Techzone IT Park Noida-201308
"POCO M4 5G (Power Black, 64 GB)",https://www.flipkart.com/poco-m4-5g-power-black-64-gb/p/itmdca739218a8a0?pid=MOBGDRGPZTSHNQ5H&lid=LSTMOBGDRGPZTSHNQ5HK2U5VI&marketplace=FLIPKART&q=mobile&store=tyy%2F4io&srno=s_3_54&otracker=AS_QueryStore_OrganicAutoSuggest_1_2_na_na_ps&otracker1=AS_QueryStore_OrganicAutoSuggest_1_2_na_na_ps&fm=organic&iid=92898ef3-1a2e-4ab4-946d-0822299c9feb.MOBGDRGPZTSHNQ5H.SEARCH&ppt=None&ppn=None&ssid=7p671kv60w0000001690221382421&qH=532c28d5412dd75b,"₹11,999",4.2,"5,946","Break all barriers and enjoy an unmatched smartphone experience with the POCO M4 5G that is designed to send chills across your body from the moment you start using it. This phone comes loaded with the Dimensity 700 processor, UFS 2.2 WriteBooster, and up to 2 GB of Turbo RAM that boosts your performance and makes multitasking a piece of cake. Moreover, the dual-camera setup with a 50 MP primary camera and 8 MP front camera allows you to click masterpieces and cherish the brilliance of their imagery.",MOBGDRGPZTSHNQ5H,"The POCO M4 5G boasts a meticulous design that is aimed at putting you in the spotlight wherever you go. With this phone in your hands, you can literally feel the whole world looking at you with envy.

The Dimensity 700 processor, UFS 2.2 WriteBooster, and up to 2 GB of Turbo RAM in the POCO M4 5G enable you to tackle all of your daily tasks with ease. Furthermore, the POCO M4 5G supports seven 5G bands, guaranteeing that you are constantly connected to the world.

The POCO M4 5G features a 16.71 cm (6.58) Smart display with a 90 Hz refresh rate and a 240 Hz touch sampling rate. While gaming, browsing, streaming, and other activities, the display gives an incredibly fluid visual effect. Moreover, to provide optimal battery life, the smart display changes between refresh rates based on usage.

This smartphone comes equipped with a dual-camera setup comprising of a 50 MP primary camera that enables you to click stunning images with enthralling imagery. Furthermore, this phone also comes with an 8 MP front camera designed to click impeccable selfies that can blow your mind away with its clarity.

With a 5000 mAh battery being employed in this phone, you can continue to use it for gaming, streaming, and much more for up to 2 days on a single charge. Moreover, it also supports 18 W fast charging that can power your phone in quick succession.","Xiaomi Technology India Pvt. Ltd., Orchid Blck, EmbassyTech Village, Devarabeesanahalli,Bangalore - 560103, Karnataka"
"POCO C55 (Cool Blue, 128 GB)",https://www.flipkart.com/poco-c55-cool-blue-128-gb/p/itm26aca9fd143ba?pid=MOBGMXSWJHRVUWFE&lid=LSTMOBGMXSWJHRVUWFESKZGEW&marketplace=FLIPKART&q=mobile&store=tyy%2F4io&srno=s_3_55&otracker=AS_QueryStore_OrganicAutoSuggest_1_2_na_na_ps&otracker1=AS_QueryStore_OrganicAutoSuggest_1_2_na_na_ps&fm=organic&iid=92898ef3-1a2e-4ab4-946d-0822299c9feb.MOBGMXSWJHRVUWFE.SEARCH&ppt=None&ppn=None&ssid=7p671kv60w0000001690221382421&qH=532c28d5412dd75b,"₹9,499",4.1,"1,364",The POCO C55 smartphone features a powerful MediaTek Helio G85 processor with 1 GHz of GPU enabling you with a smooth and hassle-free gaming experience or multitasking. It has 6 GB of Turbo RAM with an expandable RAM of up to 11 GB that allows you to switch between apps quickly. This smartphone’s leather-like texture with stitches on the panel gives it a classy look. The 50 MP dual camera featured in this smartphone has a night mode and HDR mode so you can capture life-like images. You can also enjoy long-lasting battery life with the 5000 mAh battery.,MOBGMXSWJHRVUWFE,"The POCO C55 smartphone features a MediaTek Helio G85 octa-core processor with an AnTaTu score of more than 260K. The 1 GHz of GPU allows you to efficiently multitask on different apps, play games, and much more.

This smartphone enables you to switch between apps quickly and with ease, thanks to its 6 GB of Turbo RAM with an expandable RAM of up to 11 GB.

The POCO C55 smartphone has a stylish leather-like texture with stitches on the panel and curved edges to fit in your hands easily. It is also fingerprint and smudge resistant so you can enjoy your games and watch movies without worrying about fingerprints getting in the way. The fingerprint scanner featured in this smartphone gives it a bold look and adds security.

Capture life-like images with the POCO C55 smartphone’s 50 MP dual camera. This camera allows you to take wider shots, thanks to the sensor with an aperture of up to F 1.8. Its night mode enables you to capture images even in low-light conditions and the HDR mode enhances the photos' details, colour, and contrast, making them more attractive.

POCO C55 smartphone’s screen is about 17. 04 cm (6.71) big with an HD+ display so that you can watch your favourite movies and shows on your phone. The display featured in this smartphone allows you to view the screen even in direct sunlight. 120 Hz touch sampling rate enables the phone to register your touch and deliver commands more accurately.

The 5000 mAh battery featured in this smartphone has a long-lasting battery with about 28 days of standby time, up to 39 hours of talk time, about 27 hours of binge-watching, or up to 10.5 hours of gaming time on a single charge, so you can play, work, or do anything with your phone without worrying about draining the battery.

This smartphone is IP52-rated which makes it resistant to dust and water splashes and the oleophobic coating keeps your phone fingerprint and smudge-free, so you need not worry about cleaning the screen every time.

The POCO C55 smartphone has an in-built MIUI dialer making it more user-friendly and its dual-band WiFi support enables you with fast connectivity so you always stay connected.","Xiaomi Technology India Pvt. Ltd., Orchid Blck, EmbassyTech Village, Devarabeesanahalli,Bangalore - 560103, Karnataka"
