Product Name,Product Url,Prices,Rating,Number of Review,Description,FSN,Product_Description,Manufacturer
"Google Pixel 6a (Chalk, 128 GB)",https://www.flipkart.com/google-pixel-6a-chalk-128-gb/p/itme5ae89135d44e?pid=MOBGFWEZ5SKU84Z8&lid=LSTMOBGFWEZ5SKU84Z8FXPB45&marketplace=FLIPKART&q=mobile&store=tyy%2F4io&srno=s_8_186&otracker=AS_QueryStore_OrganicAutoSuggest_1_2_na_na_ps&otracker1=AS_QueryStore_OrganicAutoSuggest_1_2_na_na_ps&fm=organic&iid=4aeb47ef-daea-4012-9245-b672c4d2b7ce.MOBGFWEZ5SKU84Z8.SEARCH&ppt=None&ppn=None&ssid=7zn4ggu30g0000001690221396557&qH=532c28d5412dd75b,"₹27,999",4.3,"6,264","Experience intuitiveness and enjoy seamless operation with smooth transition with the 5G-ready Google Pixel 6a that comes bundled with a myriad of innovative features. Powered by the Google Tensor processor built especially for Pixel enables you to experience seamless juggling and multitasking. Moreover, the powerful battery adapted into this phone gives enormous power to your phone allowing it to run for a prolonged period. Furthermore, with Face Unblur, Magic Eraser, Night Sight, and Real Tone features incorporated into this phone you can capture masterpieces and enjoy impeccable imagery.",MOBGFWEZ5SKU84Z8,"Google Tensor, Google's made-to-order processor intended for Pixel, allows applications to open swiftly, websites and photos to load rapidly, and all of it to function seamlessly, enabling the 5G-ready Pixel 6a to be snappy and intuitive.

The Google Pixel's adaptive battery can last for over 24 hours by learning your favourite applications and reducing power consumption on those you seldom use. Furthermore, with Extreme Battery Saver you can prolong your battery life by up to 72 hours by selecting which applications to run while Pixel switches off the others. You can also get hours of battery in just a few minutes owing to quick wired charging.

Face Unblur can sharpen a fuzzy face, allowing you to catch the moment even while it's in motion. Furthermore, Magic Eraser removes unwanted objects and allows you to modify the colour and brightness of an object so that it blends in. Capture city lights, starry sky, and even portraits in low light with Night Sight. Real Tone also allows you to properly and tastefully capture genuine skin tones.

The Titan M2 chip and Google Tensor security core add an extra layer of hardware security to Pixel, making it more resilient to attacks. Moreover, the Pixel 6a supports Fingerprint Unlock, which is a safe and dependable method of unlocking your phone.

The Pixel 6a is water and dust resistant owing to IP67 certification. So you can carry your phone with you on all of your adventurous escapades.

Get things done fast and conveniently with Material You, and select the background image that suits the colour of your Pixel. Additionally, with At A Glance feature, you can acquire helpful information such as recent songs when you attach your headphones or meeting calendar notifications.

Every few months, your Pixel improves with automated software upgrades that provide innovative features, techniques, and applications directly to your phone.

With Pixel's Live Translate, you can communicate in 11 languages, interpret face-to-face discussions, and understand signs directly from your phone.

Experience your favourite videos and music without advertisements with Pixel 6a, and obtain access to over 100 GB of cloud storage for 3 months to back up your files, videos, contacts, and more.

It merely takes a few minutes to transfer your favourite apps from your previous phone to the Pixel 6a. You can easily transfer messages, contacts, and photographs to your new smartphone by using the Quick Switch adapter.","Google LLC, 1600 Amphitheatre Parkway, Mountain View, CA 94043, UNITED STATES"
"REDMI 12C (Lavender Purple, 64 GB)",https://www.flipkart.com/redmi-12c-lavender-purple-64-gb/p/itm3fe4e598a0358?pid=MOBGZEVUSSJ8VGXZ&lid=LSTMOBGZEVUSSJ8VGXZQC5UNR&marketplace=FLIPKART&q=mobile&store=tyy%2F4io&srno=s_8_187&otracker=AS_QueryStore_OrganicAutoSuggest_1_2_na_na_ps&otracker1=AS_QueryStore_OrganicAutoSuggest_1_2_na_na_ps&fm=organic&iid=4aeb47ef-daea-4012-9245-b672c4d2b7ce.MOBGZEVUSSJ8VGXZ.SEARCH&ppt=None&ppn=None&ssid=7zn4ggu30g0000001690221396557&qH=532c28d5412dd75b,"₹8,714",4.2,67,NA,MOBGZEVUSSJ8VGXZ,,RISING STARS MOBILES INDIA PVT LTD
"REDMI 11 Prime (Peppy Purple, 64 GB)",https://www.flipkart.com/redmi-11-prime-peppy-purple-64-gb/p/itm6c82e6d7f5790?pid=MOBGZHFGV49WM2TC&lid=LSTMOBGZHFGV49WM2TCOOW4U6&marketplace=FLIPKART&q=mobile&store=tyy%2F4io&srno=s_8_188&otracker=AS_QueryStore_OrganicAutoSuggest_1_2_na_na_ps&otracker1=AS_QueryStore_OrganicAutoSuggest_1_2_na_na_ps&fm=organic&iid=4aeb47ef-daea-4012-9245-b672c4d2b7ce.MOBGZHFGV49WM2TC.SEARCH&ppt=None&ppn=None&ssid=7zn4ggu30g0000001690221396557&qH=532c28d5412dd75b,"₹10,999",4.3,182,"Experience the power of MediaTek Helio G99 processor to seamlessly switch between the apps and multitask easily on the Redmi Prime 11 smartphone. You can enjoy a smooth and fast display, thanks to its 90 Hz FHD+ display. Its 50 MP AI triple camera allows you to click stunning images or record videos. With the 8 MP camera you can click attractive selfies. Thanks to its 5000 mAh battery, you can watch content online, record videos, or engage in intense gaming sessions. You can have a theatre-like experience on this large screen paired with Hi-Res Audio support.",MOBGZHFGV49WM2TC,"Equipped with the power of the MediaTek Helio G99 processor you can easily multitask as you switch between the apps seamlessly. The LPDDR4X RAM and UFS 2.2 enables you to switch between the apps and transfer data instantly.

You can experience a smooth display on the 90 Hz FHD+ display with 3 stage AdaptiveSync refresh rate that makes it easy for scrolling, gaming, and much more.

This smartphone features a 50 MP AI triple camera that allows you to take trending videos and mesmerising photos. It also has an 8 MP front camera for you to take stunning selfies for your feed.

You can go all day long browsing through your phone, watching movies, playing games, or getting creative, thanks to its 5000 mAh battery.

You can have a theatre-like experience while watching your favourite movies on this smartphone’s large 16.71 cm (6.58) screen and Hi-Res audio.

The Redmi 11 Prime has a stunning design with a perfect hand grip and a smudge-free texture for convenience.","Xiaomi Technology India Pvt. Ltd., Orchid Blck, EmbassyTech Village, Devarabeesanahalli,Bangalore - 560103, Karnataka"
"SAMSUNG Galaxy F13 (Waterfall Blue, 64 GB)",https://www.flipkart.com/samsung-galaxy-f13-waterfall-blue-64-gb/p/itm583ef432b2b0c?pid=MOBGENJWBPFYJSFT&lid=LSTMOBGENJWBPFYJSFTP8FGOC&marketplace=FLIPKART&q=mobile&store=tyy%2F4io&srno=s_8_189&otracker=AS_QueryStore_OrganicAutoSuggest_1_2_na_na_ps&otracker1=AS_QueryStore_OrganicAutoSuggest_1_2_na_na_ps&fm=organic&iid=4aeb47ef-daea-4012-9245-b672c4d2b7ce.MOBGENJWBPFYJSFT.SEARCH&ppt=None&ppn=None&ssid=7zn4ggu30g0000001690221396557&qH=532c28d5412dd75b,"₹10,999",4.3,"9,205","Enjoy seamless connectivity and an uninterrupted movie marathon with the impressive Samsung Galaxy F13 that is designed specifically to impress the entertainment fanatics. This smartphone features a terrific 16.62 cm (6.6) FHD+ LCD Display that can effortlessly blow your mind with its incredible performance. Furthermore, this phone boasts a 50 MP Triple Camera setup that allows you to capture awesomeness with a gentle tap. Moreover, the Samsung Galaxy F13 sports up to 8 GB of RAM and features an innovative RAM plus technology that taps into the phone’s internal storage to elevate its performance.",MOBGENJWBPFYJSFT,"The Samsung Galaxy F13 boasts an exceptional 16.62 cm (6.6) FHD+ LCD Display that delivers a cinematic visual experience with stunning picture quality. Thus, you can seamlessly immerse yourself into your favourite movie with enhanced precision.

Thanks to the Gorilla Glass 5 adapted into this smartphone’s screen which protects it from inadvertent falls and scratches. This way you can carry your phone anywhere without any inhibition.

The Samsung Galaxy F13 comes with a monstrous 6000 mAh Battery that supports 15 W Fast Charging, allowing you to binge-watch your favourite TV show and play your favourite game seamlessly.

With the Auto Data Switching feature incorporated in this phone which automatically chooses from the best available network provider, you can enjoy unmatched data connectivity wherever you are and always stay connected to the world.

Driven by up to 8 GB of RAM and sporting an incredible RAM Plus feature that uses the phone’s internal storage and converts into virtual RAM, there is practically no stopping your multitasking ability. This way you can amplify your entertainment quotient significantly.

This phone features a stunning 50 MP Triple Camera setup that helps you to capture mesmerising images with exceptional imagery, allowing you to savour memorable events whenever your heart desires.

Your sensitive and secret data will be safeguarded wherever you go courtesy of the multi-layered Knox security built into this device, which keeps you stress-free at all times.",DFHHHFHJFHDJ
"IQOO Z6 Lite 5G (With Charger) (Stellar Green, 128 GB)",https://www.flipkart.com/iqoo-z6-lite-5g-with-charger-stellar-green-128-gb/p/itme03e6b5c65b08?pid=MOBGZ3DBJWXNNNHR&lid=LSTMOBGZ3DBJWXNNNHRAGHYG4&marketplace=FLIPKART&q=mobile&store=tyy%2F4io&srno=s_8_190&otracker=AS_QueryStore_OrganicAutoSuggest_1_2_na_na_ps&otracker1=AS_QueryStore_OrganicAutoSuggest_1_2_na_na_ps&fm=organic&iid=4aeb47ef-daea-4012-9245-b672c4d2b7ce.MOBGZ3DBJWXNNNHR.SEARCH&ppt=None&ppn=None&ssid=7zn4ggu30g0000001690221396557&qH=532c28d5412dd75b,"₹15,299",4.3,74,NA,MOBGZ3DBJWXNNNHR,,"World Trade Centre, Plot no-TZ-13A, Techzone (I.T. Park), Greater Noida, Uttar Pradesh, India. Pin - 201308"
GFive U220i,https://www.flipkart.com/gfive-u220i/p/itmcf84be4afec00?pid=MOBG6Z2GZ8EQMAK4&lid=LSTMOBG6Z2GZ8EQMAK4YKCLOI&marketplace=FLIPKART&q=mobile&store=tyy%2F4io&srno=s_8_191&otracker=AS_QueryStore_OrganicAutoSuggest_1_2_na_na_ps&otracker1=AS_QueryStore_OrganicAutoSuggest_1_2_na_na_ps&fm=organic&iid=4aeb47ef-daea-4012-9245-b672c4d2b7ce.MOBG6Z2GZ8EQMAK4.SEARCH&ppt=None&ppn=None&ssid=7zn4ggu30g0000001690221396557&qH=532c28d5412dd75b,₹699,3.4,57,G'FIVE U220i : it is a dual SIM multimedia mobile with 1.8 inch display and camera 0.3 MP 64 MB internal memory which can be expandable up to 16GB through SD Card and 32MB RAM. SIM Card Dual Sim Dual standby Ms model: GSM 2G Network: GPRS Display 1.8-inch 320 x 480$$pixel camera 0.3 Memory card type: TF Max support:16GB Music player: Mp3 Video Mp4 Bluetooth: Support Wireless FM Support Battery 1000 mAh Headphone jack:3.5 mm,MOBG6Z2GZ8EQMAK4,,GFIVE MOBILES
"IQOO Z6 Lite 5G (With Charger) (Mystic Night, 128 GB)",https://www.flipkart.com/iqoo-z6-lite-5g-with-charger-mystic-night-128-gb/p/itm18d68c87eb58e?pid=MOBGZ3DB7ZMKDHMP&lid=LSTMOBGZ3DB7ZMKDHMPFXTHC7&marketplace=FLIPKART&q=mobile&store=tyy%2F4io&srno=s_8_192&otracker=AS_QueryStore_OrganicAutoSuggest_1_2_na_na_ps&otracker1=AS_QueryStore_OrganicAutoSuggest_1_2_na_na_ps&fm=organic&iid=4aeb47ef-daea-4012-9245-b672c4d2b7ce.MOBGZ3DB7ZMKDHMP.SEARCH&ppt=None&ppn=None&ssid=7zn4ggu30g0000001690221396557&qH=532c28d5412dd75b,"₹15,299",4.3,74,NA,MOBGZ3DB7ZMKDHMP,,"World Trade Centre, Plot no-TZ-13A, Techzone (I.T. Park), Greater Noida, Uttar Pradesh, India. Pin - 201308"
Nokia 125 TA-1253 DS,https://www.flipkart.com/nokia-125-ta-1253-ds/p/itm9d3f0f651534a?pid=MOBFVD9GCC23VGHM&lid=LSTMOBFVD9GCC23VGHMNSVAAM&marketplace=FLIPKART&q=mobile&store=tyy%2F4io&srno=s_9_193&otracker=AS_QueryStore_OrganicAutoSuggest_1_2_na_na_ps&otracker1=AS_QueryStore_OrganicAutoSuggest_1_2_na_na_ps&fm=organic&iid=c79aac0a-337a-4e62-9c8a-05c6c602d3ae.MOBFVD9GCC23VGHM.SEARCH&ppt=None&ppn=None&ssid=oxl4jm0kio0000001690221399293&qH=532c28d5412dd75b,"₹2,225",4,226,"Enjoy long-lasting battery life and a 6.096-centimetre (2.4) screen with this Nokia handset. While its large and ergonomic keys make typing easy and comfortable, its storage space lets you save up to 2,000 contacts and 500 messages easily for quick access.",MOBFVD9GCC23VGHM,"Boasting large and ergonomic keys, this Nokia handset makes it convenient for you to dial numbers and type text messages. It has a robust polycarbonate shell, along with a durable finish, that make it tough as well as stylish.

Its 6.1 cm (2.4) screen helps you see its contents clearly, ensuring comfortable and enjoyable usage.

Using this feature, you can access your favourite FM stations and enjoy a wide variety of content. Oh, and you can do that with or without using a pair of earphones.

Its battery offers you long hours of usage, so you can talk to your near and dear ones for hours on end.

This phone lets you store up to 2,000 contacts and 500 messages, so you can access them anytime without any hassle.","RISING STARS MOBILE INDIA PVT LTD Plot: M-2B,Sipcot Industrial Park, Phase-2, Hi Tech SEZ DTA Area,Kancheepuram, 602106"
"IQOO Z6 Lite 5G (With Charger) (Mystic Night, 128 GB)",https://www.flipkart.com/iqoo-z6-lite-5g-with-charger-mystic-night-128-gb/p/itm18d68c87eb58e?pid=MOBGZ3DB7ZMKDHMP&lid=LSTMOBGZ3DB7ZMKDHMPFXTHC7&marketplace=FLIPKART&q=mobile&store=tyy%2F4io&srno=s_9_194&otracker=AS_QueryStore_OrganicAutoSuggest_1_2_na_na_ps&otracker1=AS_QueryStore_OrganicAutoSuggest_1_2_na_na_ps&fm=organic&iid=c79aac0a-337a-4e62-9c8a-05c6c602d3ae.MOBGZ3DB7ZMKDHMP.SEARCH&ppt=None&ppn=None&ssid=oxl4jm0kio0000001690221399293&qH=532c28d5412dd75b,"₹15,299",4.3,75,NA,MOBGZ3DB7ZMKDHMP,,"World Trade Centre, Plot no-TZ-13A, Techzone (I.T. Park), Greater Noida, Uttar Pradesh, India. Pin - 201308"
PHILIPS Xenium E209,https://www.flipkart.com/philips-xenium-e209/p/itm79739feced9a7?pid=MOBG5D6DCSXFBJNA&lid=LSTMOBG5D6DCSXFBJNAVX91NV&marketplace=FLIPKART&q=mobile&store=tyy%2F4io&srno=s_9_195&otracker=AS_QueryStore_OrganicAutoSuggest_1_2_na_na_ps&otracker1=AS_QueryStore_OrganicAutoSuggest_1_2_na_na_ps&fm=organic&iid=c79aac0a-337a-4e62-9c8a-05c6c602d3ae.MOBG5D6DCSXFBJNA.SEARCH&ppt=None&ppn=None&ssid=oxl4jm0kio0000001690221399293&qH=532c28d5412dd75b,"₹1,299",3.9,124,"This Philips mobile phone features a compact design and ensures a rich and user-friendly experience. It’s equipped with a digital camera and has dual SIM support for convenient usage. You can listen to music for hours at a time with its wireless FM radio feature, 1000 mAh battery, and high volume speaker. In case of sudden power cuts, you can use the in-built flashlight to make your way through the dark. And, with Bluetooth connectivity, you can transfer files and more with ease.",MOBG5D6DCSXFBJNA,,PHILIPS India Pvt Ltd
"SAMSUNG Galaxy M33 5G (Mystique Green, 128 GB)",https://www.flipkart.com/samsung-galaxy-m33-5g-mystique-green-128-gb/p/itme4ec54aec3acc?pid=MOBGHDXJNKTMPT8G&lid=LSTMOBGHDXJNKTMPT8GKCLUBP&marketplace=FLIPKART&q=mobile&store=tyy%2F4io&srno=s_9_196&otracker=AS_QueryStore_OrganicAutoSuggest_1_2_na_na_ps&otracker1=AS_QueryStore_OrganicAutoSuggest_1_2_na_na_ps&fm=organic&iid=c79aac0a-337a-4e62-9c8a-05c6c602d3ae.MOBGHDXJNKTMPT8G.SEARCH&ppt=None&ppn=None&ssid=oxl4jm0kio0000001690221399293&qH=532c28d5412dd75b,"₹15,990",4.2,838,"You can use the Samsung Galaxy M33 5G Smartphone for a multitude of purposes, including communication, entertainment, productivity, navigation, and much more. It is compatible with advanced 5G technology for fast internet connectivity, enabling effortless streaming, app downloads, and online communication. In addition, this smartphone's display features up to 16.72 cm (6.6) full rectangle rounded corners TFT screen with up to 1080x2400p FHD+ resolution, delivering high-quality visuals with vivid colours.",MOBGHDXJNKTMPT8G,"Boasting a 16.72 cm (6.6) full rectangle rounded corners TFT display with up to 1080x2400p FHD+ resolution, this Samsung Galaxy M33 5G Smartphone offers high-quality visuals with vibrant colours.

Featuring a sleek and slim design with a glass front and back and a durable metal frame, this smartphone is protected from damage caused by accidental drops and scratches.

Powered by a 5 nm octa-core processor, this smartphone ensures that you can multitask seamlessly and quickly.

Available with up to 6 GB of RAM, this smartphone enables you to run multiple apps and games simultaneously without experiencing any significant lag or slowdowns. So, you can toggle between apps seamlessly and enjoy a smooth and responsive mobile experience.

Offering up to 128 GB internal storage, this smartphone provides you with ample space to store all your files, photos, videos, and apps. And, you can also expand the storage further using a microSD card, allowing you to store even more content without worrying about running out of memory.

Equipped with an up to 6000 mAh battery with a reverse charging feature, this smartphone allows for extended use of your device without having to worry about running out of power. And, this smartphone is also compatible with up to 25 W USB Type-C fast charging for a quick and efficient charging performance. So, you can stay connected all day long without interruptions.

Sporting an up to 50 MP quad-camera setup, this smartphone renders eye-catching photos and videos. So, whether you're taking landscape photos, portraits, or close-ups, you can capture high-quality images with ease.

Thanks to its both face recognition and fingerprint scanner security features, this smartphone remains secure and accessible only to you.",SAMSUNG INDIA ELECTRONICS PVT LTD
"OPPO Reno10 5G (Silvery Grey, 256 GB)",https://www.flipkart.com/oppo-reno10-5g-silvery-grey-256-gb/p/itmdedc9618cea51?pid=MOBGQP3UFZA4KJYV&lid=LSTMOBGQP3UFZA4KJYVA5FVFS&marketplace=FLIPKART&q=mobile&store=tyy%2F4io&srno=s_9_197&otracker=AS_QueryStore_OrganicAutoSuggest_1_2_na_na_ps&otracker1=AS_QueryStore_OrganicAutoSuggest_1_2_na_na_ps&fm=organic&iid=en_IAAVJJFhp38gC-fSxG10xIVk8lv4ST3nFa39bZvNtSUy6bfGwGsrYJ5FFPvEBc3tEedVYWBEuWhz4uq4gaIipw%3D%3D&ppt=None&ppn=None&ssid=oxl4jm0kio0000001690221399293&qH=532c28d5412dd75b,"₹32,999",Not Available,0, ,MOBGQP3UFZA4KJYV,"With the improved imaging hardware camera in this Oppo Reno 10 5G smartphone, you can capture impressive pictures in high clarity. When your friends take photos in this camera, they are going to fall in love with your phone and would always wish for your phone’s camera for all their photoshoots. With a 64 MP Main Camera, 32 MP Telephoto Camera, 112-degree ultra-wide-angle camera, and 32 MP ultra-clear selfie camera, this phone has an awesome camera setup to lighten your moods at all times.

With the high-resolution Telephoto Camera available on this mobile, you can take pictures like a pro and create an album with innumerable photos and videos. The camera is equipped with a Sony IMX709 flagship sensor camera that offers professional portrait focal length photography where you can click clear, natural, and vivid portrait images all the time and cherish these memories for years to come.

Beautiful and blurred bokeh backgrounds are just a click away by adjusting the aperture on this phone’s camera. Take high-quality photos as you would take with your DSLR camera and just be surprised with the amazing comments you would receive from your friends and family.

This phone is designed by industry experts and has included an exclusive Portrait mode to capture moments that are worth creating memories. Perfect your every shot with the Portrait Expert Engine and be amazed by the resulting photos that are sure to mesmerise you with its perfection.

This phone has a 50 MP OIS main camera that clicks ultra-clear pictures. The camera on this phone is 112 degrees ultra-wide angle with AutoFocus smart selfie feature that lets you capture beautiful pictures of yourself and groups. Record 4K ultra-clear video whenever you are in the mood to take short videos, create reels, or simply record an event or a session.

The 3D curved design of this Oppo Reno 10 5G smartphone brings richness to the overall aesthetics of this phone. You are sure to attract onlookers with its sheer beauty, smooth contours that just fits right on your palm.

This phone delivers rock-solid performance and feels as light as a feather. The sleek design of the phone and its slim structure simply create a style statement. It weighs only about 185g and is about 7.99 mm in thickness.

Experience the ultimate comfort and convenience of scrolling through apps on this 3D curved Oppo Reno 10 smartphone. This phone is indeed an unmatched combination of comfort and elegance that you would always want to hold in your hands.

Powered with a 5000 mAh battery, this phone is a powerhouse of energy and can run for an entire day. Along with this device, you get a 67 W flash charger that can charge from 0 to 31% in just 10 minutes. The Battery Health Engine in this phone increases your battery durability by up to 4 years. With just 5 minutes of charging your phone, you can have 3.5 hours of video playback time.

Experience unbelievably smooth and quick performance with the MediaTek Dimensity 7050 SoC Processor. Effortlessly stream applications and scroll through apps swiftly at a lightning-fast speed. You get 8 GB of RAM that can be expandable up to 8 GB and vast storage space of 256 GB.

To let you use a smooth-running phone that can keep pace with your lifestyle and changing needs even after 48 months of use, Oppo has designed an interesting system-level technology that improves your stability and fluency greatly. This Oppo smartphone comes with TUV SUD 48-Month Fluency Rating A"" with 16 times memory access capability. You will also be able to run 40+ active apps in the background.

With loud and dual stereo speakers, you can hear your favourite music in full sound. These speakers are so powerful that they provide an immersive sound experience where every note and every rhythm comes alive.

You can work across different devices smoothly and seamlessly and can also screencast or share apps, files, content, notifications, etc., across your Oppo PC, phone, and Oppo Pads.

With IR remote control, you can easily control the smart appliances in your home with your phone. You can also change the settings of devices, change the speed of the fan, turn off lights, ACs, etc., right from your phone and get the complete control of your environment in your hands with the IR remote control.

With the smart Always-on-Display feature, you can receive notifications in real-time and also get information about your orders and takeaways. You also get to seamlessly connect to the music playlist with the Always-On-Display functionality that ensures uninterrupted connectivity even when your device is locked.

With the Auto Pixelate feature available on this smartphone, you can now protect your privacy while still being able to stay social. You can easily pixelate avatars and names on a single click when you share screenshots from your phone.","OPPO Mobiles India Private Limited Plot No.1, Sector Ecotech: VII, Greater Noida, Uttar Pradesh 201306"
